{
  "$schema": "https://raw.githubusercontent.com/plasmo-corp/bpp/v1/keys.schema.json",
  "chrome": {
    "clientId": "123",
    "refreshToken": "789",
    "extId": "abcd"
  },
  "firefox": {
    "extId": "aaaaaaa-aaaa-bbbb-cccc-dddddddddddd",
    "apiKey": "abcd",
    "apiSecret": "efgh"
  },
  "edge": {
    "extId": "aaaaaaa-aaaa-bbbb-cccc-dddddddddddd",
    "cookie": "abcd"
  },
  "opera": {
    "packageId": 0,
    "csrftoken": "abcd",
    "sessionid": "abcd"
  }
}
